{
  "id": "hero.customer-story",
  "category": "HERO",
  "label": "customer-story",
  "tag": "section",
  "purpose": "Customer-story hero: one long outcome-metric h1 ('X cuts Y by Z% with Rubie'), the customer's logo and a back-link to /customers.",
  "purposeIsInferred": false,
  "nameSource": "hand-reconciled from the rendered HTML section tree",
  "evidence": {
    "level": "measured",
    "instances": 5,
    "routes": 5,
    "measuredFrom": [
      "src/sections/Z1010.jsx:288-377",
      "src/sections/Z1011.jsx:288-377",
      "src/sections/Z1012.jsx:288-377",
      "src/sections/Z1019.jsx:288-377",
      "src/sections/Z1020.jsx:288-377"
    ]
  },
  "content": {
    "additionalProperties": false,
    "fields": {
      "heading": {
        "type": "string",
        "required": true,
        "maxWords": 23
      },
      "body": {
        "type": "string[]",
        "required": true,
        "maxItems": 2,
        "maxWords": 29
      },
      "ctas": {
        "type": "cta[]",
        "required": true,
        "maxItems": 1,
        "maxWords": 3
      }
    }
  },
  "constraints": {
    "onePerPage": true
  },
  "motion": {
    "allowedPatterns": [
      "css-transition",
      "none"
    ],
    "reducedMotionFallback": "instant-state"
  },
  "assetRoles": [],
  "implementedBy": "src/sections/Z1010.jsx > top[1]",
  "scope": "The 5 /customers/<name> routes.",
  "source": {
    "id": "Z1010:section@288",
    "tag": "section",
    "file": "src/sections/Z1010.jsx",
    "lines": [
      288,
      377
    ],
    "route": "/customers/granum"
  },
  "semantic": {
    "id": "hero.customer-story",
    "category": "HERO"
  },
  "generatedAssetRoles": [],
  "retrievalEligible": true
}
