{
  "id": "features.platform-primitives",
  "category": "FEATURES",
  "label": "platform-primitives",
  "tag": "section",
  "purpose": "'Platform primitives' — an interactive tabbed showcase of the core platform capabilities, with an animated panel per tab.",
  "purposeIsInferred": false,
  "nameSource": "hand-reconciled from the rendered HTML section tree",
  "evidence": {
    "level": "measured",
    "instances": 1,
    "routes": 1,
    "measuredFrom": [
      "src/sections/Z10.jsx:3528-4218"
    ]
  },
  "content": {
    "additionalProperties": false,
    "fields": {
      "heading": {
        "type": "string",
        "required": true,
        "maxWords": 2
      },
      "body": {
        "type": "string[]",
        "required": true,
        "maxItems": 1,
        "maxWords": 19
      },
      "ctas": {
        "type": "cta[]",
        "required": true,
        "maxItems": 6,
        "maxWords": 1
      }
    }
  },
  "constraints": {
    "onePerPage": true
  },
  "motion": {
    "allowedPatterns": [
      "css-transition",
      "none"
    ],
    "reducedMotionFallback": "instant-state"
  },
  "assetRoles": [],
  "implementedBy": "src/sections/Z10.jsx > top[4]",
  "scope": "The / route only.",
  "source": {
    "id": "Z10:section@3528",
    "tag": "section",
    "file": "src/sections/Z10.jsx",
    "lines": [
      3528,
      4218
    ],
    "route": "/"
  },
  "semantic": {
    "id": "features.platform-primitives",
    "category": "FEATURES"
  },
  "generatedAssetRoles": [],
  "retrievalEligible": true
}
