{
  "id": "proof.story-metrics",
  "category": "PROOF",
  "label": "story-metrics",
  "tag": "section",
  "purpose": "The customer-story metric strip — three named outcome numbers with a caption each (e.g. '3 min / Per account data entry (down from 2+ hrs)'). No heading of its own.",
  "purposeIsInferred": false,
  "nameSource": "hand-reconciled from the rendered HTML section tree",
  "evidence": {
    "level": "measured",
    "instances": 5,
    "routes": 5,
    "measuredFrom": [
      "src/sections/Z1010.jsx:378-395",
      "src/sections/Z1011.jsx:378-395",
      "src/sections/Z1012.jsx:378-395",
      "src/sections/Z1019.jsx:378-395",
      "src/sections/Z1020.jsx:378-395"
    ]
  },
  "content": {
    "additionalProperties": false,
    "fields": {
      "body": {
        "type": "string[]",
        "required": true,
        "maxItems": 6,
        "maxWords": 8
      }
    }
  },
  "constraints": {
    "onePerPage": true
  },
  "motion": {
    "allowedPatterns": [
      "none"
    ],
    "reducedMotionFallback": "instant-state"
  },
  "assetRoles": [],
  "implementedBy": "src/sections/Z1010.jsx > top[2]",
  "scope": "The 5 /customers/<name> routes.",
  "source": {
    "id": "Z1010:section@378",
    "tag": "section",
    "file": "src/sections/Z1010.jsx",
    "lines": [
      378,
      395
    ],
    "route": "/customers/granum"
  },
  "semantic": {
    "id": "proof.story-metrics",
    "category": "PROOF"
  },
  "generatedAssetRoles": [],
  "retrievalEligible": true
}
