{
  "id": "index.blog-roll",
  "category": "INDEX",
  "label": "blog-roll",
  "tag": "section",
  "purpose": "The blog index listing — a linked card per post with title, excerpt and date.",
  "purposeIsInferred": false,
  "nameSource": "hand-reconciled from the rendered HTML section tree",
  "evidence": {
    "level": "measured",
    "instances": 1,
    "routes": 1,
    "measuredFrom": [
      "src/sections/Z105.jsx:293-317"
    ]
  },
  "content": {
    "additionalProperties": false,
    "fields": {
      "heading": {
        "type": "string",
        "required": true,
        "maxWords": 12
      },
      "body": {
        "type": "string[]",
        "required": true,
        "maxItems": 2,
        "maxWords": 62
      }
    }
  },
  "constraints": {
    "onePerPage": true
  },
  "motion": {
    "allowedPatterns": [
      "css-transition",
      "none"
    ],
    "reducedMotionFallback": "instant-state"
  },
  "assetRoles": [],
  "implementedBy": "src/sections/Z105.jsx > top[2]",
  "scope": "The /blog route only.",
  "source": {
    "id": "Z105:section@293",
    "tag": "section",
    "file": "src/sections/Z105.jsx",
    "lines": [
      293,
      317
    ],
    "route": "/blog"
  },
  "semantic": {
    "id": "index.blog-roll",
    "category": "INDEX"
  },
  "generatedAssetRoles": [],
  "retrievalEligible": true
}
