{
  "id": "proof.testimonials",
  "category": "PROOF",
  "label": "testimonials",
  "tag": "section",
  "purpose": "'What our customers are saying' — a grid of quote cards, each with an avatar, a name, a role and the customer's logo.",
  "purposeIsInferred": false,
  "nameSource": "hand-reconciled from the rendered HTML section tree",
  "evidence": {
    "level": "measured",
    "instances": 1,
    "routes": 1,
    "measuredFrom": [
      "src/sections/Z10.jsx:4646-4770"
    ]
  },
  "content": {
    "additionalProperties": false,
    "fields": {
      "heading": {
        "type": "string",
        "required": true,
        "maxWords": 5
      },
      "body": {
        "type": "string[]",
        "required": true,
        "maxItems": 1,
        "maxWords": 9
      },
      "ctas": {
        "type": "cta[]",
        "required": true,
        "maxItems": 6,
        "maxWords": 3
      },
      "images": {
        "type": "image[]",
        "required": false,
        "maxItems": 8,
        "assetRoles": [
          "avatar",
          "customer-logo"
        ],
        "generatedAssetRoles": [
          "fictional-avatar",
          "placeholder-customer-logo"
        ]
      }
    }
  },
  "constraints": {
    "onePerPage": true
  },
  "motion": {
    "allowedPatterns": [
      "css-transition",
      "none"
    ],
    "reducedMotionFallback": "instant-state"
  },
  "assetRoles": [
    "avatar",
    "customer-logo"
  ],
  "implementedBy": "src/sections/Z10.jsx > top[7]",
  "scope": "The / route only.",
  "source": {
    "id": "Z10:section@4646",
    "tag": "section",
    "file": "src/sections/Z10.jsx",
    "lines": [
      4646,
      4770
    ],
    "route": "/"
  },
  "semantic": {
    "id": "proof.testimonials",
    "category": "PROOF"
  },
  "generatedAssetRoles": [
    "fictional-avatar",
    "placeholder-customer-logo"
  ],
  "retrievalEligible": true
}
