{
  "id": "features.solution-outcomes",
  "category": "FEATURES",
  "label": "solution-outcomes",
  "tag": "section",
  "purpose": "The long outcome-explainer block ('What changes when migrations just work' / 'Engineering-grade infrastructure, no engineering required') with an animated supporting visual.",
  "purposeIsInferred": false,
  "nameSource": "hand-reconciled from the rendered HTML section tree",
  "evidence": {
    "level": "measured",
    "instances": 2,
    "routes": 2,
    "measuredFrom": [
      "src/sections/Z108.jsx:889-1198",
      "src/sections/Z109.jsx:1360-1398"
    ]
  },
  "content": {
    "additionalProperties": false,
    "fields": {
      "heading": {
        "type": "string",
        "required": true,
        "maxWords": 7
      },
      "body": {
        "type": "string[]",
        "required": true,
        "maxItems": 3,
        "maxWords": 28
      },
      "items": {
        "type": "item[]",
        "required": true,
        "maxItems": 3,
        "titleMaxWords": 8,
        "bodyMaxWords": 28
      },
      "images": {
        "type": "image[]",
        "required": false,
        "maxItems": 3,
        "assetRoles": [
          "icon"
        ],
        "generatedAssetRoles": [
          "icon"
        ]
      }
    }
  },
  "constraints": {
    "onePerPage": true
  },
  "motion": {
    "allowedPatterns": [
      "none"
    ],
    "reducedMotionFallback": "instant-state"
  },
  "assetRoles": [
    "icon"
  ],
  "implementedBy": "src/sections/Z108.jsx > top[5]",
  "scope": "The 2 /solutions/* routes.",
  "source": {
    "id": "Z108:section@889",
    "tag": "section",
    "file": "src/sections/Z108.jsx",
    "lines": [
      889,
      1198
    ],
    "route": "/solutions/migration-playbooks"
  },
  "semantic": {
    "id": "features.solution-outcomes",
    "category": "FEATURES"
  },
  "generatedAssetRoles": [
    "icon"
  ],
  "retrievalEligible": true
}
