{
  "id": "hero.page-title",
  "category": "HERO",
  "label": "page-title",
  "tag": "section",
  "purpose": "Minimal title-only hero — an h1 and a short standfirst, for pages whose value is the body below rather than the opening pitch.",
  "purposeIsInferred": false,
  "nameSource": "hand-reconciled from the rendered HTML section tree",
  "evidence": {
    "level": "measured",
    "instances": 4,
    "routes": 4,
    "measuredFrom": [
      "src/sections/Z102.jsx:288-337",
      "src/sections/Z103.jsx:288-345",
      "src/sections/Z104.jsx:288-297",
      "src/sections/Z105.jsx:288-292"
    ]
  },
  "content": {
    "additionalProperties": false,
    "fields": {
      "heading": {
        "type": "string",
        "required": true,
        "maxWords": 2
      },
      "body": {
        "type": "string[]",
        "required": true,
        "maxItems": 1,
        "maxWords": 37
      },
      "ctas": {
        "type": "cta[]",
        "required": true,
        "maxItems": 2,
        "maxWords": 9
      }
    }
  },
  "constraints": {
    "onePerPage": true
  },
  "motion": {
    "allowedPatterns": [
      "css-transition",
      "none"
    ],
    "reducedMotionFallback": "instant-state"
  },
  "assetRoles": [],
  "implementedBy": "src/sections/Z102.jsx > top[1]",
  "scope": "4 routes: /product, /enterprise, /customers and /blog.",
  "source": {
    "id": "Z102:section@288",
    "tag": "section",
    "file": "src/sections/Z102.jsx",
    "lines": [
      288,
      337
    ],
    "route": "/product"
  },
  "semantic": {
    "id": "hero.page-title",
    "category": "HERO"
  },
  "generatedAssetRoles": [],
  "retrievalEligible": true
}
