{
  "id": "proof.story-grid",
  "category": "PROOF",
  "label": "story-grid",
  "tag": "section",
  "purpose": "A grid of customer-story cards linking to each /customers/<name> route, each carrying the customer logo and its headline outcome metric.",
  "purposeIsInferred": false,
  "nameSource": "hand-reconciled from the rendered HTML section tree",
  "evidence": {
    "level": "measured",
    "instances": 1,
    "routes": 1,
    "measuredFrom": [
      "src/sections/Z104.jsx:298-368"
    ]
  },
  "content": {
    "additionalProperties": false,
    "fields": {
      "heading": {
        "type": "string",
        "required": true,
        "maxWords": 23
      },
      "images": {
        "type": "image[]",
        "required": false,
        "maxItems": 10,
        "assetRoles": [
          "content-image",
          "customer-logo"
        ],
        "generatedAssetRoles": [
          "generated-illustration",
          "placeholder-customer-logo",
          "placeholder-screenshot",
          "user-supplied-asset"
        ]
      }
    }
  },
  "constraints": {
    "onePerPage": true
  },
  "motion": {
    "allowedPatterns": [
      "css-transition",
      "none"
    ],
    "reducedMotionFallback": "instant-state"
  },
  "assetRoles": [
    "content-image",
    "customer-logo"
  ],
  "implementedBy": "src/sections/Z104.jsx > top[2]",
  "scope": "The /customers route only.",
  "source": {
    "id": "Z104:section@298",
    "tag": "section",
    "file": "src/sections/Z104.jsx",
    "lines": [
      298,
      368
    ],
    "route": "/customers"
  },
  "semantic": {
    "id": "proof.story-grid",
    "category": "PROOF"
  },
  "generatedAssetRoles": [
    "generated-illustration",
    "placeholder-customer-logo",
    "placeholder-screenshot",
    "user-supplied-asset"
  ],
  "retrievalEligible": true
}
