{
  "id": "shell.header",
  "category": "SHELL",
  "label": "header",
  "tag": "header",
  "purpose": "Fixed top header: Rubie wordmark, primary nav (Product, Solutions, Use Cases, Resources) with hover mega-panels, and a Book a Demo button.",
  "purposeIsInferred": false,
  "nameSource": "hand-reconciled from the rendered HTML section tree",
  "evidence": {
    "level": "measured",
    "instances": 21,
    "routes": 21,
    "measuredFrom": [
      "src/sections/Z10.jsx:25-303",
      "src/sections/Z102.jsx:7-285",
      "src/sections/Z103.jsx:7-285",
      "src/sections/Z104.jsx:7-285",
      "src/sections/Z105.jsx:7-285",
      "src/sections/Z106.jsx:7-285",
      "src/sections/Z107.jsx:7-285",
      "src/sections/Z108.jsx:7-285",
      "src/sections/Z109.jsx:7-285",
      "src/sections/Z1010.jsx:7-285",
      "src/sections/Z1011.jsx:7-285",
      "src/sections/Z1012.jsx:7-285",
      "src/sections/Z1013.jsx:7-285",
      "src/sections/Z1014.jsx:7-285",
      "src/sections/Z1015.jsx:7-285",
      "src/sections/Z1016.jsx:7-285",
      "src/sections/Z1017.jsx:7-285",
      "src/sections/Z1018.jsx:7-285",
      "src/sections/Z1019.jsx:7-285",
      "src/sections/Z1020.jsx:7-285",
      "src/sections/Z1021.jsx:7-285"
    ]
  },
  "content": {
    "additionalProperties": false,
    "fields": {
      "listItems": {
        "type": "string[]",
        "required": false,
        "maxItems": 5,
        "maxWords": 12
      },
      "ctas": {
        "type": "cta[]",
        "required": true,
        "maxItems": 15,
        "maxWords": 8
      },
      "images": {
        "type": "image[]",
        "required": false,
        "maxItems": 1,
        "assetRoles": [
          "logo"
        ],
        "generatedAssetRoles": [
          "placeholder-brand-mark",
          "user-supplied-asset"
        ]
      }
    }
  },
  "constraints": {
    "onePerPage": true,
    "mustBeFirst": true
  },
  "motion": {
    "allowedPatterns": [
      "css-transition",
      "none"
    ],
    "reducedMotionFallback": "instant-state"
  },
  "assetRoles": [
    "logo"
  ],
  "implementedBy": "src/sections/Z10.jsx > top[0]",
  "scope": "All 21 routes. Byte-identical on every one.",
  "source": {
    "id": "Z10:header@25",
    "tag": "header",
    "file": "src/sections/Z10.jsx",
    "lines": [
      25,
      303
    ],
    "route": "/"
  },
  "semantic": {
    "id": "shell.header",
    "category": "SHELL"
  },
  "generatedAssetRoles": [
    "placeholder-brand-mark",
    "user-supplied-asset"
  ],
  "retrievalEligible": true
}
