{
  "id": "faq.accordion",
  "category": "FAQ",
  "label": "accordion",
  "tag": "section",
  "purpose": "'Your questions answered' — a question-and-answer accordion. Byte-identical on all six use-case routes, so the same questions are asked regardless of vertical.",
  "purposeIsInferred": false,
  "nameSource": "hand-reconciled from the rendered HTML section tree",
  "evidence": {
    "level": "measured",
    "instances": 6,
    "routes": 6,
    "measuredFrom": [
      "src/sections/Z1013.jsx:697-761",
      "src/sections/Z1014.jsx:697-761",
      "src/sections/Z1015.jsx:697-761",
      "src/sections/Z1016.jsx:690-754",
      "src/sections/Z1017.jsx:692-756",
      "src/sections/Z1018.jsx:697-761"
    ]
  },
  "content": {
    "additionalProperties": false,
    "fields": {
      "heading": {
        "type": "string",
        "required": true,
        "maxWords": 3
      },
      "body": {
        "type": "string[]",
        "required": true,
        "maxItems": 6,
        "maxWords": 31
      }
    }
  },
  "constraints": {
    "onePerPage": true
  },
  "motion": {
    "allowedPatterns": [
      "css-transition",
      "none"
    ],
    "reducedMotionFallback": "instant-state"
  },
  "assetRoles": [],
  "implementedBy": "src/sections/Z1013.jsx > top[4]",
  "scope": "The 6 /use-cases/* routes.",
  "source": {
    "id": "Z1013:section@697",
    "tag": "section",
    "file": "src/sections/Z1013.jsx",
    "lines": [
      697,
      761
    ],
    "route": "/use-cases/sales"
  },
  "semantic": {
    "id": "faq.accordion",
    "category": "FAQ"
  },
  "generatedAssetRoles": [],
  "retrievalEligible": true
}
