{
  "id": "features.solution-anatomy",
  "category": "FEATURES",
  "label": "solution-anatomy",
  "tag": "section",
  "purpose": "An interactive stepped anatomy of a Rubie migration — buttons stepping through the pipeline stages.",
  "purposeIsInferred": false,
  "nameSource": "hand-reconciled from the rendered HTML section tree",
  "evidence": {
    "level": "measured",
    "instances": 2,
    "routes": 2,
    "measuredFrom": [
      "src/sections/Z108.jsx:1199-1311",
      "src/sections/Z109.jsx:1399-1763"
    ]
  },
  "content": {
    "additionalProperties": false,
    "fields": {
      "heading": {
        "type": "string",
        "required": true,
        "maxWords": 6
      },
      "body": {
        "type": "string[]",
        "required": true,
        "maxItems": 4,
        "maxWords": 16
      },
      "items": {
        "type": "item[]",
        "required": true,
        "maxItems": 4,
        "titleMaxWords": 4,
        "bodyMaxWords": 16
      },
      "ctas": {
        "type": "cta[]",
        "required": true,
        "maxItems": 4,
        "maxWords": 5
      }
    }
  },
  "constraints": {
    "onePerPage": true
  },
  "motion": {
    "allowedPatterns": [
      "css-animation",
      "css-transition",
      "none"
    ],
    "reducedMotionFallback": "disable-animation"
  },
  "assetRoles": [],
  "implementedBy": "src/sections/Z108.jsx > top[6]",
  "scope": "The 2 /solutions/* routes.",
  "source": {
    "id": "Z108:section@1199",
    "tag": "section",
    "file": "src/sections/Z108.jsx",
    "lines": [
      1199,
      1311
    ],
    "route": "/solutions/migration-playbooks"
  },
  "semantic": {
    "id": "features.solution-anatomy",
    "category": "FEATURES"
  },
  "generatedAssetRoles": [],
  "retrievalEligible": true
}
