{
  "id": "narrative.problem-statement",
  "category": "NARRATIVE",
  "label": "problem-statement",
  "tag": "section",
  "purpose": "A short, punchy problem framing under the hero — one h2 claim ('Your customers' data is locked up in legacy systems.', 'Onboarding is your bottleneck.') with brief elaborations.",
  "purposeIsInferred": false,
  "nameSource": "hand-reconciled from the rendered HTML section tree",
  "evidence": {
    "level": "measured",
    "instances": 9,
    "routes": 9,
    "measuredFrom": [
      "src/sections/Z10.jsx:2931-3065",
      "src/sections/Z108.jsx:714-763",
      "src/sections/Z109.jsx:973-1016",
      "src/sections/Z1013.jsx:541-591",
      "src/sections/Z1014.jsx:541-591",
      "src/sections/Z1015.jsx:541-591",
      "src/sections/Z1016.jsx:541-591",
      "src/sections/Z1017.jsx:541-591",
      "src/sections/Z1018.jsx:541-591"
    ]
  },
  "content": {
    "additionalProperties": false,
    "fields": {
      "heading": {
        "type": "string",
        "required": true,
        "maxWords": 9
      },
      "body": {
        "type": "string[]",
        "required": true,
        "maxItems": 8,
        "maxWords": 28
      },
      "items": {
        "type": "item[]",
        "required": true,
        "maxItems": 3,
        "titleMaxWords": 7,
        "bodyMaxWords": 28
      },
      "images": {
        "type": "image[]",
        "required": false,
        "maxItems": 4,
        "assetRoles": [
          "icon"
        ],
        "generatedAssetRoles": [
          "icon"
        ]
      }
    }
  },
  "constraints": {
    "onePerPage": true
  },
  "motion": {
    "allowedPatterns": [
      "none"
    ],
    "reducedMotionFallback": "instant-state"
  },
  "assetRoles": [
    "icon"
  ],
  "implementedBy": "src/sections/Z10.jsx > top[2]",
  "scope": "9 routes: /, the six /use-cases/* routes and the two /solutions/* routes.",
  "source": {
    "id": "Z10:section@2931",
    "tag": "section",
    "file": "src/sections/Z10.jsx",
    "lines": [
      2931,
      3065
    ],
    "route": "/"
  },
  "semantic": {
    "id": "narrative.problem-statement",
    "category": "NARRATIVE"
  },
  "generatedAssetRoles": [
    "icon"
  ],
  "retrievalEligible": true
}
