{
  "id": "shell.consent-banner-root",
  "category": "SHELL",
  "label": "consent-banner-root",
  "tag": "div",
  "purpose": "The c15t cookie-consent banner mount point and its Accept/Reject card. Third-party vendor UI mounted outside <main>, not Rubie design surface.",
  "purposeIsInferred": false,
  "nameSource": "hand-reconciled from the rendered HTML section tree",
  "evidence": {
    "level": "measured",
    "instances": 21,
    "routes": 21,
    "measuredFrom": [
      "src/sections/C15tUiRootHE9Kz.jsx:24-40"
    ]
  },
  "content": {
    "additionalProperties": false,
    "fields": {
      "ctas": {
        "type": "cta[]",
        "required": true,
        "maxItems": 3,
        "maxWords": 2
      }
    }
  },
  "constraints": {
    "onePerPage": true,
    "mustBeLast": true
  },
  "motion": {
    "allowedPatterns": [
      "none"
    ],
    "reducedMotionFallback": "instant-state"
  },
  "assetRoles": [],
  "implementedBy": "src/sections/C15tUiRootHE9Kz.jsx > consent root",
  "scope": "All 21 routes.",
  "source": {
    "id": "C15tUiRootHE9Kz:div@24",
    "tag": "div",
    "file": "src/sections/C15tUiRootHE9Kz.jsx",
    "lines": [
      24,
      40
    ],
    "route": "/"
  },
  "semantic": {
    "id": "shell.consent-banner-root",
    "category": "SHELL"
  },
  "generatedAssetRoles": [],
  "retrievalEligible": false,
  "retrievalReason": "Cookie-consent banner: runtime utility UI fixed over the page, not page content; a generator must never retrieve it as a section example."
}
